{"run":172,"commit":"6a477ca","metric":14.587,"metrics":{"size_cap_ok":1,"smll_bytes":207624,"ztk_bytes":234208,"rtk_bytes":7531248,"cases":18,"smll_avg_reduction_pct":54.757,"rtk_avg_reduction_pct":27.879,"smll_avg_latency_ms":8.647,"rtk_avg_latency_ms":14.333},"status":"keep","description":"Further TSC parity compaction: use basename-only file paths while preserving :line:col and TS code","timestamp":1777060138381,"segment":4,"confidence":3.6206896551724106,"iterationTokens":2234,"asi":{"hypothesis":"TSC remained far from RTK compression; trimming path directories to basename should improve parity while keeping actionable location and code info.","fix":"tsc filter now emits `basename.ts:L:C TSxxxx` instead of directory-prefixed path; prior prefix trimming retained.","result":"parity_points improved 14.550 -> 14.587 (+0.037), size cap still satisfied and binary shrank.","actionability_check":"Location tuple and TS error code preserved; only directory context removed.","fairness_controls":"General path formatting rule, not benchmark-fixture specific."}}
{"run":173,"commit":"d6fbf71","metric":14.777,"metrics":{"size_cap_ok":1,"smll_bytes":207544,"ztk_bytes":234208,"rtk_bytes":7531248,"cases":18,"smll_avg_reduction_pct":53.702,"rtk_avg_reduction_pct":27.851,"smll_avg_latency_ms":8.465,"rtk_avg_latency_ms":14.201},"status":"keep","description":"Cargo test parity tuning: keep more native failure scaffolding and raw test-result lines","timestamp":1777060255969,"segment":4,"confidence":3.807881773399011,"iterationTokens":11218,"asi":{"hypothesis":"smll cargo output was over-compressed versus RTK; restoring selected native failure/result lines should improve parity score.","fix":"cargo_test now keeps `FAILED`/`failures:`/`thread` lines and emits raw `test result:` lines instead of compact `res ...` form.","result":"parity_points improved 14.587 -> 14.777 (+0.190) while preserving size-cap headroom.","tradeoff":"Compression decreased slightly by design to align with RTK behavior.","fairness_controls":"General filter behavior change, no fixture-specific branching."}}
