{"type":"config","name":"Fix RTK-equivalent issues in smll filters","metricName":"test_count","metricUnit":"","bestDirection":"higher"}
{"run":1,"commit":"63ae855","metric":570,"metrics":{},"status":"keep","description":"Baseline: 570 tests passing before RTK issue fixes","timestamp":1776967491645,"segment":0,"confidence":null,"iterationTokens":217,"asi":{"hypothesis":"Baseline measurement of all tests passing"}}
{"run":2,"commit":"4fc1621","metric":575,"metrics":{},"status":"keep","description":"Fix go test filter: preserve benchmark results and fuzz output (RTK #1445)","timestamp":1776967625690,"segment":0,"confidence":null,"iterationTokens":11600,"asi":{"hypothesis":"Fix go test filter to preserve benchmark and fuzz output (RTK #1445)","rtk_issue":"#1445","fix":"Added benchmark line detection, fuzz progress tracking (keep only last), and fuzz outcome markers"}}
{"run":3,"commit":"6b61410","metric":578,"metrics":{},"status":"keep","description":"Fix ls filter: ParsedNothing safety net for eza/locale issues (RTK #1475/#1454)","timestamp":1776967742569,"segment":0,"confidence":2.6666666666666665,"iterationTokens":5977,"asi":{"hypothesis":"Add ParsedNothing safety net to ls filter for eza/exa/lsd and non-English locales (RTK #1475/#1454)","fix":"ls_compact.apply returns error.ParsedNothing when content lines exist but zero filenames extracted; main.zig catches it and falls back to raw passthrough","rtk_issue":"#1475, #1454, #1451"}}
{"run":4,"commit":"verify","metric":578,"metrics":{},"status":"discard","description":"Verification: all 578 tests pass consistently after both fixes","timestamp":1776967853075,"segment":0,"confidence":5.333333333333333,"iterationTokens":4849,"asi":{"hypothesis":"Verification run - confirm all fixes stable"}}
{"run":5,"commit":"1eef6bf","metric":590,"metrics":{},"status":"keep","description":"Add rg pattern-mode compression: path-prefix RLE for path:line:content output (~15% savings)","timestamp":1777012342948,"segment":0,"confidence":6.666666666666667,"iterationTokens":31139,"asi":{"hypothesis":"rg pattern-mode output has repeated path prefixes that can be RLE-compressed","fix":"matchesPattern+applyPattern+decodePattern in rg.zig; wired in main.zig after --files check","compression":"15% on real codebase (11372->9649 bytes)","new_tests":12}}
{"run":6,"commit":"ls-loca","metric":590,"metrics":{},"status":"keep","description":"Force LC_ALL=C on ls subprocess spawn — proactive locale fix (RTK #1475)","timestamp":1777012476221,"segment":0,"confidence":3.6363636363636362,"iterationTokens":8598,"asi":{"hypothesis":"Proactively force LC_ALL=C+LANG=C on ls subprocess spawn so the parser always sees C-locale date format","fix":"Clone environ map, put LC_ALL=C+LANG=C, pass as spawn_env for ls; ParsedNothing safety net still present as second line of defense","verified":"LANG=de_DE.UTF-8 now produces correct output instead of empty"}}
{"run":7,"commit":"git-gre","metric":593,"metrics":{},"status":"keep","description":"Route git grep -n through rg pattern-mode filter: path-prefix RLE compression","timestamp":1777012766498,"segment":0,"confidence":2.875,"iterationTokens":22050,"asi":{"compression":"329->281 bytes on small example, scales with file repetition","fix":"Added grep to KnownSubcommand; routes git grep -n output through rg.matchesPattern/applyPattern","hypothesis":"git grep -n output is path:line:content format, same as rg pattern mode — route through existing filter","new_tests":3}}
{"run":8,"commit":"7bbf67b","metric":593,"metrics":{},"status":"keep","description":"Guard rg --files dirname RLE: only fires with --files/-l flag, not for rg -N output","timestamp":1777012977090,"segment":0,"confidence":3.066666666666667,"iterationTokens":2839,"asi":{"hypothesis":"Guard rg --files dirname RLE to only fire when --files/-l/--files-with-matches is present, preventing incorrect compression of rg -N (path:content) output","fix":"is_rg_files_mode + is_find_plain guards in main.zig rg/find branch","correctness":"rg -N output no longer incorrectly routed to dirname RLE"}}
{"run":9,"commit":"6c214d4","metric":595,"metrics":{},"status":"keep","description":"Fix cargo test: preserve benchmark result lines from --bench runs","timestamp":1777013101365,"segment":0,"confidence":5,"iterationTokens":10420,"asi":{"fix":"Added bench: to KEEP_NEEDLES in cargo_test.zig","hypothesis":"cargo test --bench benchmark result lines silently dropped — parallel to go_test benchmark fix","new_tests":2,"parallel_to":"go_test benchmark fix (run #2)"}}
{"run":10,"commit":"git-dif","metric":598,"metrics":{},"status":"keep","description":"Fix git diff --stat/--name-only: passthrough summary modes instead of silently dropping all lines","timestamp":1777013298712,"segment":0,"confidence":4.3076923076923075,"iterationTokens":5893,"asi":{"bug":"All lines in git diff --stat start with space — applyInner treated them as context lines and dropped them, producing empty output","fix":"Detect --stat/--shortstat/--name-only/--name-status/--summary/--compact-summary in argv and passthrough raw in those modes","hypothesis":"git diff --stat / --name-only output was silently dropped (all lines start with space = context lines)","new_tests":3,"verified":"smll git diff --stat HEAD~1 now shows full stat table"}}
{"run":11,"commit":"git-sho","metric":598,"metrics":{},"status":"keep","description":"Fix git show --stat/--name-only: passthrough summary modes (same bug as git diff --stat)","timestamp":1777013416515,"segment":0,"confidence":3.5,"iterationTokens":5013,"asi":{"bug":"git show --stat stat lines (space-leading) dropped by diff section of git_show.apply","fix":"Same pattern as git diff --stat: detect summary flags in .show branch and passthrough raw","hypothesis":"git show --stat has same space-leading-lines bug as git diff --stat"}}
{"run":12,"commit":"git-log","metric":598,"metrics":{},"status":"keep","description":"Fix git log --oneline/--stat/--format: passthrough custom format modes (same pattern)","timestamp":1777013517406,"segment":0,"confidence":4.3076923076923075,"iterationTokens":5241,"asi":{"bugs":"git log --oneline: empty output (no commit header match); git log --stat: stat lines dropped","fix":"Detect --oneline/--stat/--name-only/--format=/--pretty= flags and passthrough raw","hypothesis":"git log with custom format flags (--oneline, --stat, --format) produces output the filter doesn't understand"}}
{"run":13,"commit":"git-fla","metric":598,"metrics":{},"status":"keep","description":"Fix git log -p patch drop and git blame -s garbled output: passthrough alt-format flags","timestamp":1777013639999,"segment":0,"confidence":5.6,"iterationTokens":4687,"asi":{"bugs":"git log -p: patch section dropped (only sha+subject kept); git blame -s: garbled output (filter expects long format)","fix":"Added -p/--patch/-u to log passthrough flags; added -s/--porcelain/--line-porcelain/-e to blame passthrough flags","hypothesis":"git log -p and git blame -s use non-standard formats that filters don't handle"}}
{"type":"config","name":"Binary size and performance optimization for smll","metricName":"binary_bytes","metricUnit":"kb","bestDirection":"lower"}
{"run":14,"commit":"e3fc1a4","metric":243048,"metrics":{},"status":"keep","description":"Baseline: 243,048 bytes Linux x86_64 (CI cap 262,144 — 19KB headroom)","timestamp":1777017736800,"segment":1,"confidence":null,"iterationTokens":232,"asi":{"hypothesis":"Baseline Linux x86_64 binary size before optimization"}}
{"run":15,"commit":"d5cb450","metric":227960,"metrics":{},"status":"keep","description":"single_threaded=true in release module: -15,088 bytes (243KB→228KB, -6.2%)","timestamp":1777017786142,"segment":1,"confidence":null,"iterationTokens":1213,"asi":{"hypothesis":"single_threaded=true eliminates mutex/atomic ops from std lib — smll never spawns threads","saving_bytes":15088,"saving_pct":"6.2%"}}
{"run":16,"commit":"no-chan","metric":227960,"metrics":{},"status":"discard","description":"error_tracing/valgrind/stack_check flags: no size change in ReleaseSmall","timestamp":1777017814395,"segment":1,"confidence":null,"iterationTokens":1869,"asi":{"hypothesis":"error_tracing=false + valgrind=false + stack_check=false — no change in ReleaseSmall","rollback_reason":"No improvement, reverted extra flags","next_action_hint":"Look at what's large in the binary — HashMap/environ clone, format strings, large filters"}}
{"run":17,"commit":"35a59b3","metric":198024,"metrics":{},"status":"keep","description":"du_compact: replace f64 float libs with integer arithmetic: -30KB (228KB→198KB, -13%)","timestamp":1777017948411,"segment":1,"confidence":5.968186638388123,"iterationTokens":6712,"asi":{"hypothesis":"du_compact used f64 float parsing/formatting pulling in large Zig float libs (decimal table rodata)","fix":"Replaced std.fmt.parseFloat + float arithmetic with pure integer arithmetic in computeBytes and emitHumanSize","saving_bytes":29936,"saving_pct":"13.1% from post-single_threaded baseline of 227960","total_from_original":"243048 -> 198024 = -18.5%"}}
{"run":18,"commit":"no-chan","metric":198024,"metrics":{},"status":"discard","description":"ArrayHashMap larger than StringHashMap in ReleaseSmall — reverted","timestamp":1777018401671,"segment":1,"confidence":2.9840933191940615,"iterationTokens":1545,"asi":{"finding":"ArrayHashMap is 6KB LARGER than StringHashMap in ReleaseSmall; StringHashMap's open-addressing is more code-size efficient","hypothesis":"ArrayHashMap might be smaller than StringHashMap","rollback_reason":"ArrayHashMap produced 204KB vs 198KB with StringHashMap"}}
{"run":19,"commit":"du-emit","metric":197784,"metrics":{},"status":"keep","description":"du_compact: deduplicate emitHumanSize format strings into single emitTenths helper: -240 bytes","timestamp":1777018611090,"segment":1,"confidence":3.0240513094601815,"iterationTokens":9572,"asi":{"fix":"Replaced 4 duplicate print format strings with single emitTenths helper","hypothesis":"4 identical writer.print format strings in emitHumanSize duplicate format machinery","saving_bytes":240}}
{"run":20,"commit":"stash-n","metric":197712,"metrics":{},"status":"keep","description":"Remove std.debug.print from git_stash passthrough: -72 bytes, stderr forwarded by caller","timestamp":1777018711288,"segment":1,"confidence":145.30769230769232,"iterationTokens":5963,"asi":{"fix":"Removed std.debug.print from git_stash.zig passthrough path — stderr forwarding is handled by the caller in main.zig","hypothesis":"std.debug.print pulls in debug formatting machinery","saving_bytes":72}}
{"run":21,"commit":"du-inse","metric":189160,"metrics":{},"status":"keep","description":"du_compact: replace std.mem.sort with insertion sort: -8,528 bytes (avoids pdqsort)","timestamp":1777018812107,"segment":1,"confidence":11.745422842197035,"iterationTokens":1126,"asi":{"fix":"Replaced std.mem.sort (pdqsort) with inline insertion sort in du_compact; du -s output has <=100 entries so O(n^2) is fine","hypothesis":"std.mem.sort pulls in generic pdqsort implementation (~8.5KB)","saving_bytes":8528,"saving_pct":"-4.3% from 197688"}}
{"run":22,"commit":"d6dcded","metric":189160,"metrics":{},"status":"keep","description":"Final state: 189,160 bytes Linux x86_64 (-22.2% from 243,048), 598 tests passing","timestamp":1777018915360,"segment":1,"confidence":6.07942238267148,"iterationTokens":3697,"asi":{"hypothesis":"Final verification of all optimizations combined","total_reduction_bytes":53888,"total_reduction_pct":"22.2%","tests":598}}
{"run":23,"commit":"omit-fr","metric":188760,"metrics":{},"status":"keep","description":"omit_frame_pointer=true in release module: -400 bytes","timestamp":1777019264466,"segment":1,"confidence":6.208600182982616,"iterationTokens":18142,"asi":{"hypothesis":"omit_frame_pointer=true removes frame pointer register saves from function prologues","saving_bytes":400}}
{"run":24,"commit":"remove-","metric":185976,"metrics":{},"status":"keep","description":"Remove SMLL_DETECT/SMLL_VALIDATE prototype flags and ws_rle dead code: -2,784 bytes","timestamp":1777019503176,"segment":1,"confidence":6.617810760667903,"iterationTokens":14876,"asi":{"fix":"Removed SMLL_DETECT/SMLL_VALIDATE prototype env flags from main.zig pipe path; removed duplicate ws_rle import (local const shadowing the module-level import)","hypothesis":"detect+validator+sigil_rle are undocumented prototype features costing ~2.8KB; dead code should be eliminated","saving_bytes":2784}}
{"run":25,"commit":"cleanup","metric":185976,"metrics":{},"status":"keep","description":"Clean up dead imports (detect/validator/ws_rle) from main.zig and release_mod: code hygiene","timestamp":1777019597507,"segment":1,"confidence":6.494310423304507,"iterationTokens":3373,"asi":{"hypothesis":"Removing explicit detect/validator/ws_rle imports from main.zig and release_mod — Zig DCE already removed the code, no additional size savings","note":"Clean code improvement: no dead imports"}}
{"run":26,"commit":"hoist-l","metric":185840,"metrics":{},"status":"keep","description":"Hoist SMLL_LOSSLESS lookup to single const in runWrapper: -136 bytes + cleaner code","timestamp":1777019775822,"segment":1,"confidence":6.390527256478999,"iterationTokens":14794,"asi":{"fix":"Single const lossless at top of runWrapper, 10 inner declarations removed","hypothesis":"10 redundant SMLL_LOSSLESS HashMap lookups in runWrapper — hoist to one variable","saving_bytes":136}}
{"run":27,"commit":"53b736e","metric":185840,"metrics":{},"status":"keep","description":"Final: 185,840 bytes (-23.5%), 598 tests passing, 76KB headroom","timestamp":1777019809511,"segment":1,"confidence":9.427818061964404,"iterationTokens":919,"asi":{"final_state":"185,840 bytes Linux x86_64, 598 tests, 76KB headroom vs CI cap","total_reduction_bytes":57208,"total_reduction_pct":"23.5%"}}
{"run":28,"commit":"show-fo","metric":186080,"metrics":{},"status":"keep","description":"Fix git show --no-patch/--format: passthrough custom format flags (+240 bytes, fixes silent empty output)","timestamp":1777020111973,"segment":1,"confidence":17.23132530120482,"iterationTokens":14897,"asi":{"bug":"git show --format=%s --no-patch and git show -s produced empty output — git_show.apply dropped everything","fix":"Added --no-patch/-s and --format=/--pretty= to show passthrough guards","hypothesis":"git show with custom format or no-patch flags produces output shape git_show.apply can't handle"}}
{"run":29,"commit":"show-bl","metric":186160,"metrics":{},"status":"keep","description":"Fix git show HEAD:path blob passthrough: empty output when viewing file blobs","timestamp":1777020230645,"segment":1,"confidence":17.23132530120482,"iterationTokens":6226,"asi":{"bug":"git show HEAD:path (blob specifier) produced empty output — file content doesn't look like a commit to git_show.apply","fix":"Detect argv containing ':' in non-flag position (blob specifier) and passthrough raw","hypothesis":"git show with object:path specifier outputs file blob, not commit format"}}
{"run":30,"commit":"abbrev-","metric":186208,"metrics":{},"status":"keep","description":"Fix git log --abbrev-commit: empty output due to isCommitLine requiring 40-char SHA","timestamp":1777020418516,"segment":1,"confidence":17.23132530120482,"iterationTokens":7345,"asi":{"bug":"git log --abbrev-commit produces empty output — isCommitLine requires 40-char SHA but --abbrev-commit gives 7-8 chars","fix":"Added --abbrev-commit to log_custom_format passthrough flags","hypothesis":"git log --abbrev-commit uses shortened SHAs, breaking isCommitLine which checks for exactly 40 hex chars"}}
{"run":31,"commit":"diff-pa","metric":186288,"metrics":{},"status":"keep","description":"Fix git diff --patch-with-stat and git blame --incremental: passthrough alt-format flags","timestamp":1777020537390,"segment":1,"confidence":18.74442988204456,"iterationTokens":4214,"asi":{"bugs":"git diff --patch-with-stat drops stat section; git blame --incremental garbled (machine-readable format)","fix":"Added --patch-with-stat to diff passthrough; added --incremental to blame passthrough"}}
{"run":32,"commit":"show-ra","metric":186320,"metrics":{},"status":"keep","description":"Fix git show --raw passthrough + resolve merge conflict markers in source files","timestamp":1777020774706,"segment":1,"confidence":20.548850574712645,"iterationTokens":9386,"asi":{"fixes":["git show --raw passthrough added","conflict markers resolved in main.zig/autoresearch files","git show --raw shows full raw diff objects instead of dropping them"]}}
{"run":33,"commit":"e414eb8","metric":186320,"metrics":{},"status":"keep","description":"Final state: 186,320 bytes (-23.3%), 598 tests, 6 correctness bugs fixed in git flag handling","timestamp":1777020909349,"segment":1,"confidence":35.31358024691358,"iterationTokens":4970,"asi":{"final_state":"186,320 bytes Linux x86_64 (-23.3% from 243,048), 598 tests, 75KB headroom","correctness_fixes":["git show --no-patch/--format","git show HEAD:path blob","git log --abbrev-commit","git diff --patch-with-stat","git blame --incremental","git show --raw"],"size_fixes":["single_threaded","f64->int","pdqsort->insertion","prototype flags removed","omit_frame_pointer"]}}
{"run":34,"commit":"npm-tes","metric":186512,"metrics":{},"status":"keep","description":"Route npm/pnpm/yarn/bun test through jest filter when jest output detected","timestamp":1777021210294,"segment":1,"confidence":85.13095238095238,"iterationTokens":13946,"asi":{"fix":"Extended is_jest to include npm/pnpm/yarn/bun test script runners via output-shape detection","hypothesis":"npm test often runs jest/vitest but output not filtered; jest.matches() guards against false positives from other runners","new_feature":"smll npm test now applies jest filter when jest output detected"}}
{"run":35,"commit":"f2faef7","metric":184632,"metrics":{},"status":"keep","description":"Honor SMLL_LOSSLESS=1 for git subcommands by raw passthrough (status/diff/log/show/add/commit/push/pull/fetch/merge/rebase/checkout/branch/stash/blame)","timestamp":1777029069348,"segment":1,"confidence":49.50508474576271,"iterationTokens":31894,"asi":{"hypothesis":"SMLL_LOSSLESS=1 should bypass all filters byte-identically; several git routes still formatted output","fix":"Added lossless passthrough guards across git subcommand switch; verified git show/diff/status now raw in lossless mode","verification":"zig build test --summary all => 598 pass; release metric improved to 184632 bytes"}}
{"run":36,"commit":"f2faef7","metric":184704,"metrics":{},"status":"discard","description":"Try removing proactive ls locale env override (LC_ALL/LANG) and rely on ParsedNothing raw fallback only","timestamp":1777029144943,"segment":1,"confidence":36.148514851485146,"iterationTokens":31894,"asi":{"hypothesis":"Removing per-spawn env clone/put for ls might reduce binary size while preserving correctness via ParsedNothing fallback","rollback_reason":"No primary metric improvement (+72 bytes vs best 184632)","next_action_hint":"Keep locale override removed only if it meaningfully shrinks size; otherwise retain current behavior and target other hotspots","result":"598 tests pass; binary 184704 bytes"}}
{"run":37,"commit":"f2faef7","metric":184720,"metrics":{},"status":"discard","description":"Refactor git log branch and introduce passthrough helper to reduce duplicated raw-write code","timestamp":1777029241776,"segment":1,"confidence":36.32835820895522,"iterationTokens":5760,"asi":{"hypothesis":"Removing dead lossless branch in git log and sharing raw passthrough call sites might reduce code size","rollback_reason":"Primary metric regressed (+88 bytes vs best 184632)","next_action_hint":"Revert helper abstraction; prioritize algorithmic/library-footprint reductions over minor control-flow refactors","result":"598 tests pass; no correctness gain observed"}}
{"run":38,"commit":"f2faef7","metric":184624,"metrics":{},"status":"keep","description":"Micro-optimize npm/pnpm/yarn/bun test detection with first-byte switch (same behavior, smaller codegen)","timestamp":1777029334338,"segment":1,"confidence":36.15346534653465,"iterationTokens":7705,"asi":{"hypothesis":"The recent jest script-runner detection can be codegen-optimized by branching on first byte before full eql comparisons","fix":"Replaced 4-way OR of std.mem.eql with switch(cmd_basename[0]) -> targeted eql checks","verification":"598 tests pass; release size improved to 184624 bytes"}}
{"run":39,"commit":"f2faef7","metric":184616,"metrics":{},"status":"keep","description":"Micro-optimize jest/vitest dispatch using first-byte switch plus npm-script fallback","timestamp":1777029378337,"segment":1,"confidence":35.71638141809291,"iterationTokens":850,"asi":{"hypothesis":"Direct jest/vitest detection can use first-byte switch to reduce comparison code while preserving behavior","fix":"Replaced OR chain (jest/vitest/is_script) with switch(cmd_basename[0]) and fallback to is_npm_or_script_test","verification":"598 tests pass; binary reduced to 184616 bytes"}}
{"run":40,"commit":"f2faef7","metric":184400,"metrics":{},"status":"keep","description":"Share argv[1]==test predicate across cargo/go/npm script-runner detection to reduce duplicate checks","timestamp":1777029435827,"segment":1,"confidence":35.41545893719807,"iterationTokens":1611,"asi":{"hypothesis":"Repeated argv len/test-subcommand checks in test-runner dispatch generate duplicate code; hoisting common predicate should shrink binary","fix":"Introduced is_test_subcmd and reused for cargo test, go test, and npm/pnpm/yarn/bun test detection","verification":"598 tests pass; binary reduced to 184400 bytes"}}
