{"run":78,"commit":"f2faef7","metric":183464,"metrics":{},"status":"keep","description":"Deduplicate repeated --stat/--name-* / --compact-summary flag bundle via hasStatOrNameFlags helper","timestamp":1777037592740,"segment":1,"confidence":95.48717948717949,"iterationTokens":1537,"asi":{"hypothesis":"Diff/log/show each repeated the same 5 hasArg checks; a shared helper should reduce dispatch code size","fix":"Added `hasStatOrNameFlags(argv)` helper and reused it in git diff/log/show mode guards","verification":"598 tests pass; binary reduced to 183464 bytes"}}
{"run":79,"commit":"f2faef7","metric":184544,"metrics":{},"status":"discard","description":"Hoist docker/kubectl/npm command booleans only inside columnar wrapper internals","timestamp":1777037668213,"segment":1,"confidence":92.52173913043478,"iterationTokens":3381,"asi":{"hypothesis":"Keeping outer wrapper membership OR-chain unchanged while hoisting inner docker/kubectl/npm checks could reduce repeated eql calls","rollback_reason":"Primary metric regressed significantly (+904 bytes vs best 183640 at start, +1080 vs current best 183464?)","next_action_hint":"Avoid internal command-boolean hoists in columnar branch; direct checks compile much smaller","tests_passed":598}}
{"run":80,"commit":"f2faef7","metric":183464,"metrics":{},"status":"discard","description":"Force noinline on new hasStatOrNameFlags helper","timestamp":1777037748543,"segment":1,"confidence":95.48717948717949,"iterationTokens":1039,"asi":{"hypothesis":"Out-of-lining hasStatOrNameFlags (used by diff/log/show) might reduce inlined duplication","rollback_reason":"No primary metric improvement (unchanged at 183464 bytes)","next_action_hint":"Leave hasStatOrNameFlags at compiler default inlining","tests_passed":598}}
{"run":81,"commit":"f2faef7","metric":183720,"metrics":{},"status":"discard","description":"Force inline hasStatOrNameFlags helper","timestamp":1777037801823,"segment":1,"confidence":96.72727272727273,"iterationTokens":566,"asi":{"hypothesis":"Inlining shared stat/name flag helper might remove call overhead and shrink code","rollback_reason":"Primary metric regressed (+256 bytes vs best 183464)","next_action_hint":"Do not force inline; default inlining is best for this helper","tests_passed":598}}
{"run":82,"commit":"f2faef7","metric":183464,"metrics":{},"status":"discard","description":"Re-test noinline on hasArg after recent helper dedup optimizations","timestamp":1777037884363,"segment":1,"confidence":98,"iterationTokens":1332,"asi":{"hypothesis":"With hasStatOrNameFlags and arg1 hoists in place, out-of-lining hasArg might now reduce total code size","rollback_reason":"No primary metric improvement (unchanged at 183464 bytes)","next_action_hint":"Keep hasArg at default inlining; no measurable benefit","tests_passed":598}}
{"run":83,"commit":"f2faef7","metric":183824,"metrics":{},"status":"discard","description":"Hoist is_cargo_cmd/is_go_cmd and reuse across test + build detection","timestamp":1777037941025,"segment":1,"confidence":98,"iterationTokens":1352,"asi":{"hypothesis":"Reusing cargo/go command equality checks across both test and build wrapper routing may reduce duplicated comparisons","rollback_reason":"Primary metric regressed (+360 bytes vs best 183464)","next_action_hint":"Keep direct command comparisons in each local context; broad-scope command booleans are size-negative","tests_passed":598}}
{"run":84,"commit":"f2faef7","metric":184648,"metrics":{},"status":"discard","description":"Extract columnar-wrapper command OR-chain into noinline helper function","timestamp":1777038039105,"segment":1,"confidence":98,"iterationTokens":3435,"asi":{"hypothesis":"Moving the long wrapper-command OR-chain into an out-of-line helper might reduce main dispatch code size","rollback_reason":"Primary metric regressed significantly (+1184 bytes vs best 183464)","next_action_hint":"Keep columnar wrapper command check inline in runWrapper","tests_passed":598}}
{"run":85,"commit":"f2faef7","metric":183472,"metrics":{},"status":"discard","description":"Re-test split hasFormatOrPrettyArg (exact flags via hasArg + separate prefix scan) after recent helper refactors","timestamp":1777038148897,"segment":1,"confidence":98,"iterationTokens":3435,"asi":{"hypothesis":"With newer flag helpers in place, splitting exact/prefix format checks might now reduce code size","rollback_reason":"Primary metric regressed (+8 bytes vs best 183464)","next_action_hint":"Keep single-loop hasFormatOrPrettyArg implementation","tests_passed":598}}
{"run":86,"commit":"f2faef7","metric":183456,"metrics":{},"status":"keep","description":"Set KnownSubcommand enum backing type to u8","timestamp":1777038211477,"segment":1,"confidence":98.01315789473684,"iterationTokens":1438,"asi":{"hypothesis":"Pinning KnownSubcommand to a fixed small integer backing type may reduce enum/switch codegen size","fix":"Changed `KnownSubcommand` to `enum(u8)`","verification":"598 tests pass; binary reduced to 183456 bytes"}}
{"run":87,"commit":"f2faef7","metric":183768,"metrics":{},"status":"discard","description":"Set git_status Section enum backing type to u8","timestamp":1777038281990,"segment":1,"confidence":107.17985611510791,"iterationTokens":2180,"asi":{"hypothesis":"Explicit small backing type for internal Section enum may reduce filter state-machine codegen","rollback_reason":"Primary metric regressed (+312 bytes vs best 183456)","next_action_hint":"Keep default enum backing type in git_status","tests_passed":598}}
{"run":88,"commit":"f2faef7","metric":183456,"metrics":{},"status":"discard","description":"Set build_compact LineKind enum backing type to u8","timestamp":1777038327752,"segment":1,"confidence":118.23809523809524,"iterationTokens":1729,"asi":{"hypothesis":"Explicit backing type for build_compact line classifier enum may shrink state dispatch code","rollback_reason":"No primary metric improvement (unchanged at 183456 bytes)","next_action_hint":"Keep default enum backing type in build_compact","tests_passed":598}}
{"run":89,"commit":"f2faef7","metric":183456,"metrics":{},"status":"discard","description":"Re-test direct argv[1] parsing in git stringToEnum (remove subcmd_str temporary) after latest refactors","timestamp":1777038414478,"segment":1,"confidence":116.390625,"iterationTokens":2599,"asi":{"hypothesis":"With current dispatch structure and enum(u8), removing subcmd_str may now save bytes","rollback_reason":"No primary metric improvement (unchanged at 183456 bytes)","next_action_hint":"Keep whichever form reads better; no size difference now","tests_passed":598}}
{"run":90,"commit":"f2faef7","metric":0,"metrics":{},"status":"crash","description":"Attempt to disable PIE for release executable in build.zig","timestamp":1777038443473,"segment":1,"confidence":116.390625,"iterationTokens":1405,"asi":{"hypothesis":"Disabling PIE might reduce binary size for linux release artifact","error":"Zig 0.16 Build.ExecutableOptions does not support .pie field","rollback_reason":"Build configuration unsupported; compile failed","next_action_hint":"Use only supported Build.zig executable options for this Zig version"}}
{"run":91,"commit":"f2faef7","metric":2870609,"metrics":{},"status":"discard","description":"Build release executable with self-hosted backend (.use_llvm = false)","timestamp":1777038514068,"segment":1,"confidence":114.6,"iterationTokens":1784,"asi":{"hypothesis":"Using non-LLVM backend might produce smaller binaries for this workload","rollback_reason":"Catastrophic regression (+2.69MB vs best 183456)","next_action_hint":"Keep LLVM backend for release size optimization","tests_passed":598,"finding":"Self-hosted backend currently emits far larger release artifact in this project"}}
{"run":92,"commit":"f2faef7","metric":466197,"metrics":{},"status":"discard","description":"Disable LLD for release executable (.use_lld = false)","timestamp":1777038583280,"segment":1,"confidence":102.7448275862069,"iterationTokens":635,"asi":{"hypothesis":"System linker might produce smaller output than lld for this binary","rollback_reason":"Large regression (+282,741 bytes vs best 183456)","next_action_hint":"Keep default linker (lld) for release builds","tests_passed":598}}
{"run":93,"commit":"f2faef7","metric":183464,"metrics":{},"status":"discard","description":"Try narrower KnownSubcommand backing type enum(u4) instead of enum(u8)","timestamp":1777038639616,"segment":1,"confidence":112.86363636363636,"iterationTokens":777,"asi":{"hypothesis":"Using minimal-width enum backing type (u4) for 16 git subcommands might reduce switch code size further","rollback_reason":"Primary metric regressed (+8 bytes vs best 183456)","next_action_hint":"Keep enum(u8) for KnownSubcommand","tests_passed":598}}
{"run":94,"commit":"f2faef7","metric":183488,"metrics":{},"status":"discard","description":"Inline hasFormatOrPrettyArg calls in log/show conditions (remove temporary locals)","timestamp":1777038711206,"segment":1,"confidence":110.35555555555555,"iterationTokens":1454,"asi":{"hypothesis":"Removing local bool temporaries for format/pretty detection might reduce small amount of dispatch overhead","rollback_reason":"Primary metric regressed (+32 bytes vs best 183456)","next_action_hint":"Keep explicit local variables for format/pretty checks","tests_passed":598}}
{"run":95,"commit":"f2faef7","metric":183456,"metrics":{},"status":"discard","description":"Reorder KnownSubcommand enum fields alphabetically","timestamp":1777038771888,"segment":1,"confidence":107.95652173913044,"iterationTokens":1030,"asi":{"hypothesis":"Enum declaration order may influence stringToEnum codegen and shrink dispatch table","rollback_reason":"No primary metric improvement (unchanged at 183456 bytes)","next_action_hint":"Keep existing enum order for readability; no size effect","tests_passed":598}}
{"run":96,"commit":"f2faef7","metric":183368,"metrics":{},"status":"keep","description":"Precompute hasStatOrNameFlags(argv) once per git dispatch and reuse in diff/log/show","timestamp":1777038856042,"segment":1,"confidence":108.9051094890511,"iterationTokens":2564,"asi":{"hypothesis":"Even with a shared helper, calling hasStatOrNameFlags separately in diff/log/show duplicates call sites; precomputing once may reduce code size","fix":"Added `has_stat_or_name_flags` before git switch and reused it in diff_summary_mode, log_custom_format, and show_summary_mode","verification":"598 tests pass; binary reduced to 183368 bytes"}}
{"run":97,"commit":"f2faef7","metric":183368,"metrics":{},"status":"discard","description":"Precompute hasFormatOrPrettyArg(argv) once per git dispatch and reuse in log/show","timestamp":1777038911116,"segment":1,"confidence":109.70588235294117,"iterationTokens":921,"asi":{"hypothesis":"Like stat/name flags, computing format/pretty flag detection once might reduce duplicated call sites","rollback_reason":"No primary metric improvement (unchanged at 183368 bytes)","next_action_hint":"Keep current structure either way; no measurable size effect","tests_passed":598}}
{"run":98,"commit":"f2faef7","metric":183376,"metrics":{},"status":"discard","description":"Force noinline on hasStatOrNameFlags after single precomputed call-site refactor","timestamp":1777039004448,"segment":1,"confidence":111.34328358208955,"iterationTokens":963,"asi":{"hypothesis":"Now that hasStatOrNameFlags is evaluated once, out-of-lining it may shrink inlined code in git dispatch","rollback_reason":"Primary metric regressed (+8 bytes vs best 183368)","next_action_hint":"Keep default inlining for hasStatOrNameFlags","tests_passed":598}}
{"run":99,"commit":"f2faef7","metric":183368,"metrics":{},"status":"discard","description":"Extract log patch-flag trio (-p/--patch/-u) into hasPatchFlags helper","timestamp":1777039065502,"segment":1,"confidence":113.03030303030303,"iterationTokens":1107,"asi":{"hypothesis":"Deduplicating the three patch-related hasArg checks into a helper may reduce log dispatch expression size","rollback_reason":"No primary metric improvement (unchanged at 183368 bytes)","next_action_hint":"Keep inline patch-flag checks or helper interchangeably; no size effect","tests_passed":598}}
{"run":100,"commit":"f2faef7","metric":183368,"metrics":{},"status":"discard","description":"Inline hasStatOrNameFlags expression at single precomputed call site and remove helper function","timestamp":1777039196318,"segment":1,"confidence":105.81560283687944,"iterationTokens":1547,"asi":{"hypothesis":"With only one call site, eliminating hasStatOrNameFlags helper may remove function overhead and shrink code","rollback_reason":"No primary metric improvement (unchanged at 183368 bytes)","next_action_hint":"Either helper or inline expression is equivalent; keep clearer helper form","tests_passed":598}}
{"run":101,"commit":"f2faef7","metric":184976,"metrics":{},"status":"discard","description":"Hoist docker/kubectl command booleans (without npm) in columnar wrapper internals","timestamp":1777039273868,"segment":1,"confidence":98.15789473684211,"iterationTokens":1126,"asi":{"hypothesis":"Local booleans for docker/kubectl may reduce repeated cmd_basename comparisons in logs/compact checks","rollback_reason":"Primary metric regressed heavily (+1,520 bytes vs best 183456; +1,608 vs current 183368)","next_action_hint":"Do not hoist docker/kubectl booleans in columnar wrapper; direct eql checks are much smaller","tests_passed":598}}
{"run":102,"commit":"f2faef7","metric":183368,"metrics":{},"status":"discard","description":"Extract git blame alternate-format flag bundle into hasBlameAltFormat helper","timestamp":1777039347402,"segment":1,"confidence":93.25,"iterationTokens":2308,"asi":{"hypothesis":"Moving 7-way blame flag OR-chain into helper may reduce switch-arm code size","rollback_reason":"No primary metric improvement (unchanged at 183368 bytes)","next_action_hint":"Keep inline blame_alt_format expression or helper interchangeably; no size impact","tests_passed":598}}
{"run":103,"commit":"f2faef7","metric":183368,"metrics":{},"status":"discard","description":"Reuse existing has_arg1 boolean in non-git guard instead of rechecking argv.len < 2","timestamp":1777039416439,"segment":1,"confidence":87.76470588235294,"iterationTokens":997,"asi":{"hypothesis":"Reusing precomputed has_arg1 may remove duplicate length check code in git entry guard","rollback_reason":"No primary metric improvement (unchanged at 183368 bytes)","next_action_hint":"Keep either form; no measurable effect","tests_passed":598}}
{"run":104,"commit":"f2faef7","metric":183368,"metrics":{},"status":"discard","description":"Remove has_arg1 temp by deriving git-subcommand presence from arg1.len==0 guard","timestamp":1777039558390,"segment":1,"confidence":84.29378531073446,"iterationTokens":3852,"asi":{"hypothesis":"Eliminating has_arg1 and reusing arg1 for non-git guard may trim duplicate length-check code","rollback_reason":"No primary metric improvement (unchanged at 183368 bytes)","next_action_hint":"Keep existing has_arg1/argv.len guard form for clarity","tests_passed":598}}
{"run":105,"commit":"f2faef7","metric":183368,"metrics":{},"status":"discard","description":"Remove unused readAllStdin helper from main.zig","timestamp":1777039662385,"segment":1,"confidence":81.08695652173913,"iterationTokens":1807,"asi":{"hypothesis":"Eliminating an unused helper may reduce binary if it was still retained","rollback_reason":"No primary metric improvement (unchanged at 183368 bytes)","next_action_hint":"Assume DCE already removed dead helpers; focus on live dispatch paths","tests_passed":598}}
{"run":106,"commit":"f2faef7","metric":183368,"metrics":{},"status":"discard","description":"Drop unused has_arg1 temporary (derive arg1 directly from argv.len check)","timestamp":1777039739422,"segment":1,"confidence":83.82022471910112,"iterationTokens":1272,"asi":{"hypothesis":"Removing an unused local should slightly reduce wrapper dispatch code","rollback_reason":"No primary metric improvement (unchanged at 183368 bytes)","next_action_hint":"No value in further micro-cleanups of dead locals","tests_passed":598}}
{"run":107,"commit":"f2faef7","metric":184904,"metrics":{},"status":"discard","description":"Force inline hasArg helper","timestamp":1777039797125,"segment":1,"confidence":81.08695652173913,"iterationTokens":640,"asi":{"hypothesis":"Inlining hot hasArg helper might remove call overhead and shrink dispatch code","rollback_reason":"Large regression (+1536 bytes vs best 183368)","next_action_hint":"Never force-inline hasArg; compiler default is much better","tests_passed":598}}
{"run":108,"commit":"f2faef7","metric":183328,"metrics":{},"status":"keep","description":"Fix lossless bug for rg/find wrappers by early lossless passthrough in path-list branch","timestamp":1777039915092,"segment":1,"confidence":83.40782122905028,"iterationTokens":2285,"asi":{"hypothesis":"Path-list branch should honor SMLL_LOSSLESS for rg --files/find outputs; current logic still compressed rg files-mode in lossless","fix":"Refactored rg/find branch to early `if (lossless)` passthrough before find_compact/rg pattern/files filters; preserves raw output in lossless mode","verification":"598 tests pass; verified SMLL_LOSSLESS=1 now keeps raw rg --files lines; binary improved to 183328 bytes"}}
{"run":109,"commit":"f2faef7","metric":184416,"metrics":{},"status":"discard","description":"Minimal tree-lossless guard: gate tree.matches with !lossless","timestamp":1777040106797,"segment":1,"confidence":81.1413043478261,"iterationTokens":1002,"asi":{"hypothesis":"Adding a minimal !lossless gate in tree/bun branch would fix lossless tree compression with negligible size impact","rollback_reason":"Primary metric regressed significantly (+1048 bytes vs best 183368)","next_action_hint":"Tree-lossless correctness fix likely needs a different structure or coordinated refactor to avoid code-size blowup","tests_passed":598,"finding":"Even minimal lossless gate in tree branch inflates binary notably"}}
{"run":110,"commit":"f2faef7","metric":183176,"metrics":{},"status":"keep","description":"Pre-slice git argv (argv[1..]) and reuse for git flag scans (hasArg/hasFormatOrPrettyArg/hasStatOrNameFlags)","timestamp":1777040182341,"segment":1,"confidence":83.62011173184358,"iterationTokens":2008,"asi":{"hypothesis":"Many git-branch flag checks repeatedly scan full argv including command token; using a git-only argv slice should reduce call-site overhead","fix":"Added `git_argv = argv[1..]` and switched git diff/log/show/blame flag checks + helper calls to scan git_argv","verification":"598 tests pass; binary reduced to 183176 bytes"}}
{"run":111,"commit":"f2faef7","metric":183176,"metrics":{},"status":"discard","description":"Use git_argv[1..] for git show blob-specifier scan (instead of argv[2..])","timestamp":1777040231551,"segment":1,"confidence":91.26829268292683,"iterationTokens":838,"asi":{"hypothesis":"Consistent use of pre-sliced git_argv may slightly reduce index/slice setup in show_blob detection","rollback_reason":"No primary metric improvement (unchanged at 183176 bytes)","next_action_hint":"Keep either variant; no measurable size difference","tests_passed":598}}
{"run":112,"commit":"f2faef7","metric":183176,"metrics":{},"status":"discard","description":"Use git_flags_argv (argv[2..]) for git flag scans instead of git_argv (argv[1..])","timestamp":1777040370934,"segment":1,"confidence":94.13836477987421,"iterationTokens":4474,"asi":{"hypothesis":"Skipping the subcommand token in git flag scans may reduce hasArg/hasFormatOrPrettyArg overhead","rollback_reason":"No primary metric improvement (unchanged at 183176 bytes)","next_action_hint":"Either git_argv or git_flags_argv is equivalent for size; keep clearer variant","tests_passed":598}}
{"run":113,"commit":"f2faef7","metric":183176,"metrics":{},"status":"discard","description":"Re-test noinline hasFormatOrPrettyArg with latest git-argv refactors","timestamp":1777040421960,"segment":1,"confidence":95.94871794871794,"iterationTokens":1005,"asi":{"hypothesis":"After recent git dispatch refactors, out-of-lining hasFormatOrPrettyArg may now reduce call-site expansion","rollback_reason":"No primary metric improvement (unchanged at 183176 bytes)","next_action_hint":"Keep default inlining for hasFormatOrPrettyArg","tests_passed":598}}
{"run":114,"commit":"f2faef7","metric":183176,"metrics":{},"status":"discard","description":"Reimplement hasArg with index-based while loop instead of for-loop iterator","timestamp":1777040479116,"segment":1,"confidence":99.12582781456953,"iterationTokens":731,"asi":{"hypothesis":"Manual while loop may compile to smaller scan logic for hot hasArg helper","rollback_reason":"No primary metric improvement (unchanged at 183176 bytes)","next_action_hint":"Keep original concise for-loop implementation","tests_passed":598}}
{"run":115,"commit":"f2faef7","metric":183960,"metrics":{},"status":"discard","description":"Pre-slice command args as cmd_argv and reuse for non-git hasArg/flag scanners + git subcommand setup","timestamp":1777040547887,"segment":1,"confidence":102.52054794520548,"iterationTokens":1565,"asi":{"hypothesis":"Scanning argv without command token across non-git and git setup may reduce repeated overhead","rollback_reason":"Primary metric regressed (+784 bytes vs best 183176)","next_action_hint":"Keep direct argv usage + targeted git_argv slice only; broad cmd_argv abstraction is size-negative","tests_passed":598}}
