{"run":41,"commit":"f2faef7","metric":184456,"metrics":{},"status":"discard","description":"Try reusing cmd_basename[0] (c0) across test-runner switches for smaller codegen","timestamp":1777029483454,"segment":1,"confidence":36.20246913580247,"iterationTokens":1212,"asi":{"hypothesis":"Caching first byte in a local constant might reduce repeated indexing/comparison code","rollback_reason":"Primary metric regressed (+56 bytes vs best 184400)","next_action_hint":"Prefer direct literals in switch expressions; continue targeting duplicated predicates with measurable wins","result":"598 tests pass; change not size-effective"}}
{"run":42,"commit":"f2faef7","metric":184384,"metrics":{},"status":"keep","description":"Inline npm/pnpm/yarn/bun test-runner detection directly into is_jest switch (remove intermediate const)","timestamp":1777029546095,"segment":1,"confidence":37.035353535353536,"iterationTokens":1667,"asi":{"hypothesis":"Eliminating intermediate is_npm_or_script_test and using a single switch may reduce code size","fix":"Merged script-runner checks into is_jest switch with is_test_subcmd gating per runner","verification":"598 tests pass; binary now 184384 bytes"}}
{"run":43,"commit":"f2faef7","metric":184384,"metrics":{},"status":"discard","description":"Verification run after context resume: confirm current best size and tests before new changes","timestamp":1777029599709,"segment":1,"confidence":37.508951406649615,"iterationTokens":1667,"asi":{"hypothesis":"Establish clean checkpoint before further optimizations","rollback_reason":"No improvement over current best (same metric)","next_action_hint":"Pursue new size reductions in hot dispatch logic without altering behavior","tests_passed":598}}
{"run":44,"commit":"f2faef7","metric":184240,"metrics":{},"status":"keep","description":"Deduplicate git --format/--pretty flag detection into shared helper for log/show dispatch","timestamp":1777029666621,"segment":1,"confidence":38.0880829015544,"iterationTokens":1991,"asi":{"hypothesis":"The duplicated loop checking --format/--pretty in both .log and .show inflates code size; sharing one helper should reduce binary","fix":"Added hasFormatOrPrettyArg(argv) and reused it in log/show branches","verification":"598 tests passing; binary reduced to 184240 bytes"}}
{"run":45,"commit":"f2faef7","metric":184440,"metrics":{},"status":"discard","description":"Refactor repeated git passthrough write sequences into shared helper across add..stash/blame/grep/unknown","timestamp":1777029737273,"segment":1,"confidence":37.12626262626262,"iterationTokens":4485,"asi":{"hypothesis":"Large-scale deduplication of repeated passthrough write pairs should reduce code size","rollback_reason":"Metric regressed (+200 bytes vs best 184240)","next_action_hint":"Avoid passthrough helper abstraction; direct write pairs compile smaller in this codebase","tests_passed":598}}
{"run":46,"commit":"f2faef7","metric":184272,"metrics":{},"status":"discard","description":"Rewrite git diff summary-flag detection from repeated hasArg calls to single argv scan loop","timestamp":1777029792602,"segment":1,"confidence":36.21182266009852,"iterationTokens":1717,"asi":{"hypothesis":"Single-pass argv scan for diff summary flags could reduce code size vs multiple hasArg calls","rollback_reason":"Metric regressed (+32 bytes vs best 184240)","next_action_hint":"Keep hasArg-based form for diff; target larger duplicated flag scanners elsewhere","tests_passed":598}}
{"run":47,"commit":"f2faef7","metric":184272,"metrics":{},"status":"discard","description":"Replace std.meta.stringToEnum git subcommand parsing with manual first-byte parser","timestamp":1777029861935,"segment":1,"confidence":37.220253164556965,"iterationTokens":1824,"asi":{"hypothesis":"Manual subcommand parser might be smaller than std.meta.stringToEnum-based enum parsing","rollback_reason":"Metric regressed (+32 bytes vs best 184240)","next_action_hint":"Keep std.meta.stringToEnum; it compiles smaller here than hand-written parser","tests_passed":598}}
{"run":48,"commit":"f2faef7","metric":184240,"metrics":{},"status":"discard","description":"Force noinline on hasArg and hasFormatOrPrettyArg to test code-size tradeoff","timestamp":1777029911960,"segment":1,"confidence":38.286458333333336,"iterationTokens":1469,"asi":{"hypothesis":"Preventing inlining of shared flag-scan helpers might reduce duplicated call-site code","rollback_reason":"No improvement over current best (metric unchanged)","next_action_hint":"Keep compiler default inlining; focus on structural deduplication that measurably shrinks binary","tests_passed":598}}
{"run":49,"commit":"f2faef7","metric":184248,"metrics":{},"status":"discard","description":"Split hasFormatOrPrettyArg into exact-flag checks via hasArg plus separate prefix scan","timestamp":1777029964409,"segment":1,"confidence":37.79434447300771,"iterationTokens":996,"asi":{"hypothesis":"Reusing hasArg for --format/--pretty exact matches may shrink helper implementation","rollback_reason":"Metric regressed (+8 bytes vs best 184240)","next_action_hint":"Keep single-loop hasFormatOrPrettyArg implementation; avoid extra helper call layering","tests_passed":598}}
{"run":50,"commit":"f2faef7","metric":183984,"metrics":{},"status":"keep","description":"Compute cmd_basename once in runWrapper and reuse for ls spawn-env + dispatch (remove duplicate basename extraction)","timestamp":1777030021646,"segment":1,"confidence":37.47715736040609,"iterationTokens":2426,"asi":{"hypothesis":"Duplicate basename extraction logic before spawn and before dispatch bloats code; hoisting once should reduce binary","fix":"Introduced single outer_cmd/cmd_basename computation at top of runWrapper and reused it for ls env gating and later dispatch","verification":"598 tests pass; binary reduced to 183984 bytes"}}
{"run":51,"commit":"f2faef7","metric":183976,"metrics":{},"status":"keep","description":"Hoist is_rg_cmd/is_find_cmd booleans in wrapper dispatch to avoid repeated cmd_basename equality checks","timestamp":1777030087683,"segment":1,"confidence":38.96569920844327,"iterationTokens":949,"asi":{"hypothesis":"Repeated std.mem.eql checks against cmd_basename for rg/find can be hoisted to shared booleans to shrink code","fix":"Added is_rg_cmd/is_find_cmd and reused in rg/find branch predicates","verification":"598 tests pass; binary reduced to 183976 bytes"}}
{"run":52,"commit":"f2faef7","metric":184120,"metrics":{},"status":"discard","description":"Hoist is_tree_cmd/is_bun_cmd booleans in tree/bun wrapper routing","timestamp":1777030135796,"segment":1,"confidence":40.57142857142857,"iterationTokens":740,"asi":{"hypothesis":"Reusing tree/bun command booleans might reduce repeated equality checks","rollback_reason":"Metric regressed (+144 bytes vs best 183976)","next_action_hint":"Do not hoist tree/bun booleans; keep direct eql checks in this branch","tests_passed":598}}
{"run":53,"commit":"f2faef7","metric":185232,"metrics":{},"status":"discard","description":"Hoist docker/kubectl/npm command booleans in columnar wrapper dispatch","timestamp":1777030190449,"segment":1,"confidence":40.79558011049724,"iterationTokens":2679,"asi":{"hypothesis":"Reusing docker/kubectl/npm equality checks in the columnar branch could reduce repeated comparisons","rollback_reason":"Metric regressed significantly (+1,256 bytes vs best 183976)","next_action_hint":"Revert command-boolean hoisting in large wrapper condition; direct comparisons are smaller here","tests_passed":598}}
{"run":54,"commit":"f2faef7","metric":184040,"metrics":{},"status":"discard","description":"Change hasArg to skip argv[0] (scan argv[1..] only) since callers search for flags","timestamp":1777030260234,"segment":1,"confidence":40.57142857142857,"iterationTokens":1835,"asi":{"hypothesis":"Avoid scanning argv[0] in hasArg because all callsites check option flags, potentially shrinking helper logic","rollback_reason":"Metric regressed (+64 bytes vs best 183976)","next_action_hint":"Keep original full-slice hasArg; this micro-guard and slice offset increases code size","tests_passed":598}}
{"run":55,"commit":"f2faef7","metric":184920,"metrics":{},"status":"discard","description":"Inline tsc command checks instead of storing is_tsc local boolean","timestamp":1777030331086,"segment":1,"confidence":51.63636363636363,"iterationTokens":1921,"asi":{"hypothesis":"Removing is_tsc temporary and inlining cmd_basename==\"tsc\" checks might reduce code size","rollback_reason":"Metric regressed heavily (+944 bytes vs best 183976)","next_action_hint":"Keep dedicated is_tsc local; repeated eql calls are more expensive in code size","tests_passed":598}}
{"run":56,"commit":"f2faef7","metric":183976,"metrics":{},"status":"discard","description":"Remove unreachable lossless branch inside git log else-path (call applyCompact directly)","timestamp":1777030423929,"segment":1,"confidence":60.03252032520325,"iterationTokens":859,"asi":{"hypothesis":"The inner `if (lossless)` in git log branch is unreachable and removing it may shrink code","rollback_reason":"No primary metric improvement (unchanged at 183976 bytes)","next_action_hint":"Keep simplification only if paired with other wins; hunt larger duplicated dispatch logic","tests_passed":598}}
{"run":57,"commit":"f2faef7","metric":185136,"metrics":{},"status":"discard","description":"Replace large columnar-wrapper OR-chain with first-byte switch classifier","timestamp":1777030510533,"segment":1,"confidence":62.57627118644068,"iterationTokens":1211,"asi":{"hypothesis":"A first-byte switch for columnar wrapper command names might compile smaller than a long OR-chain of eql checks","rollback_reason":"Primary metric regressed (+1,160 bytes vs best 183976)","next_action_hint":"Keep direct OR-chain for wrapper membership; switch-based classifier is code-size negative here","tests_passed":598}}
{"run":58,"commit":"f2faef7","metric":183944,"metrics":{},"status":"keep","description":"Remove `.unknown` enum variant and switch via optional stringToEnum with explicit else passthrough","timestamp":1777030566711,"segment":1,"confidence":62.610169491525426,"iterationTokens":1257,"asi":{"hypothesis":"Carrying an explicit `.unknown` variant may add enum/switch overhead; optional enum handling could be smaller","fix":"KnownSubcommand no longer includes unknown; dispatch now uses `if (stringToEnum(...)) |subcmd| switch ... else passthrough`","verification":"598 tests pass; binary reduced to 183944 bytes"}}
{"run":59,"commit":"f2faef7","metric":183944,"metrics":{},"status":"discard","description":"Inline argv[1] directly into stringToEnum call (remove subcmd_str temporary)","timestamp":1777030615449,"segment":1,"confidence":61.05785123966942,"iterationTokens":717,"asi":{"hypothesis":"Eliminating `subcmd_str` temporary might shave a few bytes in git dispatch","rollback_reason":"No primary metric improvement (unchanged at 183944 bytes)","next_action_hint":"Focus on structural dispatch simplifications; tiny temporary removals are noise-limited","tests_passed":598}}
{"run":60,"commit":"f2faef7","metric":184080,"metrics":{},"status":"discard","description":"Force inline hasFormatOrPrettyArg helper to test call-vs-inline size tradeoff","timestamp":1777030674043,"segment":1,"confidence":63.14529914529915,"iterationTokens":622,"asi":{"hypothesis":"Inlining a tiny helper used in log/show may reduce call overhead and shrink binary","rollback_reason":"Metric regressed (+136 bytes vs best 183944)","next_action_hint":"Keep default inlining heuristics for helper functions","tests_passed":598}}
{"run":61,"commit":"f2faef7","metric":184264,"metrics":{},"status":"discard","description":"Try manual first-byte git subcommand parser after removing enum unknown variant","timestamp":1777030756867,"segment":1,"confidence":70.02843601895735,"iterationTokens":3491,"asi":{"hypothesis":"With `.unknown` removed, a custom parser may now beat stringToEnum in code size","rollback_reason":"Metric regressed (+320 bytes vs best 183944)","next_action_hint":"Keep std.meta.stringToEnum optional dispatch; manual parser remains larger","tests_passed":598}}
{"run":62,"commit":"f2faef7","metric":183912,"metrics":{},"status":"keep","description":"Set only LC_ALL=C for ls spawn env (drop redundant LANG=C override)","timestamp":1777030874060,"segment":1,"confidence":79.48387096774194,"iterationTokens":1097,"asi":{"hypothesis":"LC_ALL already dominates locale selection; setting LANG in addition is redundant and may add code size","fix":"Removed `ls_env.put(\"LANG\", \"C\")` while keeping proactive `LC_ALL=C` for ls parser stability","verification":"598 tests pass; binary reduced to 183912 bytes"}}
{"run":63,"commit":"f2faef7","metric":183928,"metrics":{},"status":"discard","description":"Refactor columnar-wrapper branch to gate !lossless once around inner dispatch chain","timestamp":1777030999011,"segment":1,"confidence":78.63829787234043,"iterationTokens":4674,"asi":{"hypothesis":"Hoisting repeated `!lossless` checks into one outer gate in columnar-wrapper dispatch may reduce code size","rollback_reason":"Primary metric regressed (+16 bytes vs best 183912)","next_action_hint":"Keep repeated !lossless checks in-place for this branch; compiler already optimizes current form better","tests_passed":598}}
{"run":64,"commit":"f2faef7","metric":183912,"metrics":{},"status":"discard","description":"Force noinline on hasFormatOrPrettyArg only","timestamp":1777031084537,"segment":1,"confidence":77.81052631578947,"iterationTokens":640,"asi":{"hypothesis":"Keeping hasFormatOrPrettyArg out-of-line (used in log/show only) might reduce duplicated inline code","rollback_reason":"No primary metric improvement (unchanged at 183912 bytes)","next_action_hint":"Leave helper at default inlining; pursue larger structural wins","tests_passed":598}}
{"run":65,"commit":"f2faef7","metric":183912,"metrics":{},"status":"discard","description":"Inline argv[0] directly into cmd_basename extraction (remove outer_cmd temporary)","timestamp":1777031150520,"segment":1,"confidence":81.67955801104972,"iterationTokens":708,"asi":{"hypothesis":"Removing outer_cmd temporary in basename extraction might shave a few bytes","rollback_reason":"No primary metric improvement (unchanged at 183912 bytes)","next_action_hint":"Keep whichever form is clearer; size impact is negligible","tests_passed":598}}
{"run":66,"commit":"f2faef7","metric":183912,"metrics":{},"status":"discard","description":"Force noinline on hasArg helper","timestamp":1777031224906,"segment":1,"confidence":85.95348837209302,"iterationTokens":1034,"asi":{"hypothesis":"Out-of-lining hasArg may reduce cumulative inlined flag-scan code at many call sites","rollback_reason":"No primary metric improvement (unchanged at 183912 bytes)","next_action_hint":"Keep compiler default for hasArg; optimization appears neutral","tests_passed":598}}
{"run":67,"commit":"f2faef7","metric":183776,"metrics":{},"status":"keep","description":"Add global early return for lossless git mode and remove per-subcommand lossless checks in git dispatch","timestamp":1777031322943,"segment":1,"confidence":85.65317919075144,"iterationTokens":3433,"asi":{"hypothesis":"Centralizing lossless passthrough before git subcommand switch removes repeated runtime checks and dead branches, shrinking code","fix":"Added early `if (lossless) { passthrough; return }` before git subcommand parsing; removed lossless checks from status/diff/log/show/add..stash/blame/grep branches","verification":"598 tests pass; binary reduced to 183776 bytes"}}
{"run":68,"commit":"f2faef7","metric":183776,"metrics":{},"status":"discard","description":"Inline argv[1] directly in stringToEnum after global git-lossless refactor","timestamp":1777031385173,"segment":1,"confidence":85.16091954022988,"iterationTokens":731,"asi":{"hypothesis":"After refactoring git dispatch, removing subcmd_str temporary might now provide extra size savings","rollback_reason":"No primary metric improvement (unchanged at 183776 bytes)","next_action_hint":"Retain clearer subcmd_str temporary or keep either form; focus on larger control-flow reductions","tests_passed":598}}
{"run":69,"commit":"f2faef7","metric":185488,"metrics":{},"status":"discard","description":"Attempt full global lossless early-return refactor across all wrappers (remove all !lossless guards)","timestamp":1777031480825,"segment":1,"confidence":83.71751412429379,"iterationTokens":4689,"asi":{"hypothesis":"A single global lossless bypass might allow deleting repeated `!lossless` checks and shrink dispatch code","rollback_reason":"Large regression (+1,712 bytes vs best 183776)","next_action_hint":"Keep lossless checks localized; global lossless refactor appears to inhibit beneficial optimizer paths","tests_passed":598,"finding":"Global early lossless + guard removals hurt code size despite simpler source"}}
{"run":70,"commit":"f2faef7","metric":183776,"metrics":{},"status":"discard","description":"Remove now-unreachable `if (lossless)` branches from git add/commit/push/pull/fetch/merge/rebase/checkout/branch/stash handlers","timestamp":1777036951264,"segment":1,"confidence":83.24719101123596,"iterationTokens":1569,"asi":{"hypothesis":"After adding git-level lossless early return, per-subcommand lossless branches are dead and removing them may reduce size","rollback_reason":"No primary metric improvement (unchanged at 183776 bytes)","next_action_hint":"Keep simplification only if combined with another win; otherwise prioritize changes with measurable size impact","tests_passed":598}}
{"run":71,"commit":"f2faef7","metric":183776,"metrics":{},"status":"discard","description":"Inline SMLL_LOSSLESS env lookup at use-site and remove envFlagOn helper","timestamp":1777037036174,"segment":1,"confidence":83.71751412429379,"iterationTokens":2431,"asi":{"hypothesis":"Removing single-use envFlagOn helper might reduce function overhead and shrink binary","rollback_reason":"No primary metric improvement (unchanged at 183776 bytes)","next_action_hint":"Keep whichever form is clearer; focus on larger dispatch-structure opportunities","tests_passed":598}}
{"run":72,"commit":"f2faef7","metric":183744,"metrics":{},"status":"keep","description":"Hoist shared argv[1]==\"build\" predicate across cargo/go build detection","timestamp":1777037105604,"segment":1,"confidence":84.23863636363636,"iterationTokens":1392,"asi":{"hypothesis":"As with test-runner dispatch, sharing the `argv[1]==build` check across cargo/go build predicates may reduce duplicated code","fix":"Added `is_build_subcmd` and reused it for `is_cargo_build` and `is_go_build`","verification":"598 tests pass; binary reduced to 183744 bytes"}}
{"run":73,"commit":"f2faef7","metric":183640,"metrics":{},"status":"keep","description":"Hoist shared argv[1]==\"logs\" predicate across docker/kubectl logs detection","timestamp":1777037181455,"segment":1,"confidence":95.2051282051282,"iterationTokens":1248,"asi":{"hypothesis":"Sharing `argv[1]==logs` check across docker/kubectl logs predicates should reduce duplicated command-arg checks","fix":"Added `is_logs_subcmd` and reused it in `is_docker_logs`/`is_kubectl_logs`","verification":"598 tests pass; binary reduced to 183640 bytes"}}
{"run":74,"commit":"f2faef7","metric":183752,"metrics":{},"status":"discard","description":"Hoist npm install/i/ci subcommand predicate before npm command check","timestamp":1777037249159,"segment":1,"confidence":87.36470588235294,"iterationTokens":807,"asi":{"hypothesis":"Separating npm install subcommand detection into shared predicate may reduce duplicated argv checks","rollback_reason":"Primary metric regressed (+112 bytes vs best 183640)","next_action_hint":"Keep original combined npm install predicate; this decomposition increases code size","tests_passed":598}}
{"run":75,"commit":"f2faef7","metric":183720,"metrics":{},"status":"keep","description":"Hoist shared argv[1] extraction (`arg1`) and reuse across test/logs/npm-install/build subcommand checks","timestamp":1777037401321,"segment":1,"confidence":88.4047619047619,"iterationTokens":2798,"asi":{"hypothesis":"Repeated `argv.len>=2 && argv[1]==...` checks across wrappers duplicate code; sharing arg1 should reduce binary size","fix":"Added `has_arg1` + `arg1` once and replaced repeated argv[1]/len checks for test, logs, npm install variants, and build","verification":"598 tests pass; binary reduced to 183720 bytes"}}
{"run":76,"commit":"f2faef7","metric":183720,"metrics":{},"status":"discard","description":"Remove now-unused has_arg1 temporary (inline len check in arg1 init)","timestamp":1777037466125,"segment":1,"confidence":89.46987951807229,"iterationTokens":809,"asi":{"hypothesis":"Eliminating a trivial temporary constant may marginally reduce code size after arg1 hoist","rollback_reason":"No primary metric improvement (unchanged at 183720 bytes)","next_action_hint":"Keep either form; focus on larger repeated-dispatch patterns","tests_passed":598}}
{"run":77,"commit":"f2faef7","metric":183792,"metrics":{},"status":"discard","description":"Reuse shared arg1 for git subcommand enum parse instead of separate subcmd_str","timestamp":1777037538099,"segment":1,"confidence":92.24844720496894,"iterationTokens":712,"asi":{"hypothesis":"Reusing arg1 in stringToEnum may reduce one temporary and shrink git dispatch setup","rollback_reason":"Primary metric regressed (+72 bytes vs best 183720)","next_action_hint":"Keep dedicated subcmd_str assignment for git parse","tests_passed":598}}
